{
  "schema": "nab.pending-list/1",
  "plan_ref": "00000000-0000-4000-8000-000000000001",
  "records": [
    {
      "schema": "nab.pending-transaction/1",
      "source_system": "ynab-web",
      "private_entity_ref": "ynp1_4f3zgyOMUsSnX1m-EHAb9IU91MdhdnEKQSxfiksVabY",
      "public_transaction_id": null,
      "accepted": false,
      "cleared": "Uncleared",
      "public_account_id": null,
      "private_account_ref": "yna1_v5o3VKox7N5frQPMk2uay56juiQV367nmcRdYf8Uf8w",
      "account_name": "Synthetic Checking",
      "date": "2026-08-30",
      "amount_milliunits": "-7777",
      "payee_name": null,
      "imported_payee": "SYNTHETIC PENDING NO PAYEE",
      "provider_cleansed_payee": null,
      "memo": null,
      "capabilities": {
        "public_get": false,
        "public_update": false,
        "private_read": true,
        "private_write": false
      },
      "observed_at": "2026-08-30T12:00:00.000Z",
      "lifecycle": "raw_staging",
      "source_value": "raw_pending",
      "relationship": null,
      "budget_effect": "none"
    }
  ],
  "snapshot": {
    "observed_at": "2026-08-30T12:00:00.000Z",
    "ynab_sync_age_ms": 0,
    "sync_in_progress": false,
    "bootstrap_complete": true,
    "backfill_complete": true,
    "complete_for_materialized_snapshot": true,
    "materialized_first_date": "2026-08-30",
    "materialized_last_date": "2026-08-30",
    "provider_retention_guaranteed": false,
    "source": "browser-catalog"
  },
  "warnings": ["UNMAPPED_ACCOUNT"],
  "ordered_by": "date_desc_then_private_ref_asc"
}
